{
  "$schema": "https://json-schema.org/draft/2020-12/schema",
  "$id": "https://personal-quant-terminal.local/schemas/dataset-manifest-v5.schema.json",
  "title": "PQT canonical dataset manifest, schema version 5",
  "description": "Describes one build of an exported research dataset. The backend generates it; a consumer validates against this schema before reading a single row. The two languages agreeing on a file is what keeps them from drifting apart, which ADR-004 raised and left open.",
  "type": "object",
  "additionalProperties": false,
  "required": [
    "dataset_id",
    "dataset_version",
    "schema_version",
    "content_hash",
    "known_as_of_utc",
    "adjusted",
    "announcement_policy",
    "universe_code",
    "universe_as_of",
    "membership",
    "instruments",
    "interval",
    "from_date",
    "to_date",
    "transformation_version",
    "validation_version",
    "adjustment_version",
    "sources",
    "files",
    "history_sessions",
    "fundamentals",
    "row_count",
    "created_at_utc",
    "created_by_commit",
    "request"
  ],
  "properties": {
    "dataset_id": {
      "description": "Derived from the export parameters, not issued at random, so the same request names the same dataset.",
      "type": "string",
      "pattern": "^[0-9a-f]{16}$"
    },
    "dataset_version": {
      "description": "Which build of this dataset it is. Deliberately excluded from content_hash.",
      "type": "integer",
      "minimum": 1
    },
    "schema_version": {
      "description": "Which manifest shape this is. A reader that does not know the version must refuse rather than guess which fields it can trust.",
      "type": "integer",
      "const": 5
    },
    "content_hash": {
      "description": "Digest over every field except dataset_version, created_at_utc and created_by_commit — the three that say which run this was rather than what the data is. Recompute it on load; a mismatch means the manifest's own fields were changed after the export.",
      "type": "string",
      "pattern": "^[0-9a-f]{64}$"
    },
    "known_as_of_utc": {
      "description": "The observation instant the bars were read at, or null for the current series. Null is a legitimate export and a different object from a point-in-time one.",
      "type": [
        "string",
        "null"
      ],
      "format": "date-time"
    },
    "adjusted": {
      "description": "Whether prices were rescaled for corporate actions.",
      "type": "boolean"
    },
    "announcement_policy": {
      "description": "What the read did with an action whose announcement date is unknown. A dataset built permissively carries look-ahead into every experiment run against it.",
      "type": "string",
      "enum": [
        "strict",
        "permissive"
      ]
    },
    "universe_code": {
      "type": "string",
      "minLength": 1
    },
    "universe_as_of": {
      "description": "The date the constituent set was read at, for an as_of dataset; null for a point_in_time one, which reads membership on every session. Never later than to_date, or the export applies a later membership to earlier prices.",
      "type": [
        "string",
        "null"
      ],
      "format": "date"
    },
    "membership": {
      "description": "How rows were matched to membership. as_of: one constituent set, read at universe_as_of, applied to the whole window. point_in_time: a row exists only where its instrument was a member that session, and each instrument lists its spells. See ADR-024.",
      "type": "string",
      "enum": [
        "as_of",
        "point_in_time"
      ]
    },
    "instruments": {
      "description": "The exported set. The identifier is the identity; the ticker is a label valid at universe_as_of, or at export time for a point_in_time dataset, and appears nowhere in the data rows, so nothing can be joined on it by accident.",
      "type": "array",
      "minItems": 1,
      "items": {
        "type": "object",
        "additionalProperties": false,
        "required": [
          "instrument_id",
          "ticker_at_as_of",
          "exchange",
          "spells",
          "history_from"
        ],
        "properties": {
          "instrument_id": {
            "type": "string",
            "format": "uuid"
          },
          "ticker_at_as_of": {
            "type": "string",
            "minLength": 1
          },
          "exchange": {
            "type": "string",
            "minLength": 1
          },
          "spells": {
            "description": "For a point_in_time dataset, when the instrument was a member within the window: from is inclusive, until is the exclusive date it left or null if it was still a member at to_date. announced_on is when the admission was published, removal_announced_on when the removal was; trading either earlier is look-ahead. Null for an as_of dataset.",
            "type": [
              "array",
              "null"
            ],
            "items": {
              "type": "object",
              "additionalProperties": false,
              "required": [
                "from",
                "until",
                "announced_on",
                "removal_announced_on"
              ],
              "properties": {
                "from": {
                  "type": "string",
                  "format": "date"
                },
                "until": {
                  "type": [
                    "string",
                    "null"
                  ],
                  "format": "date"
                },
                "announced_on": {
                  "type": [
                    "string",
                    "null"
                  ],
                  "format": "date"
                },
                "removal_announced_on": {
                  "description": "When the removal was published, when known and on or before to_date; null otherwise, and always null for a spell still open in the universe's own record. Selling ahead of the exclusion before this date is look-ahead.",
                  "type": [
                    "string",
                    "null"
                  ],
                  "format": "date"
                }
              }
            }
          },
          "history_from": {
            "description": "The first session of this instrument's rows when history_sessions > 0, or null when the export carried no history or the instrument has no rows. Every row from here up to its last membership session (to_date for an as_of dataset) is data, including rows before its first spell and between two spells; a row outside those bounds, or outside a spell when this is null, is an integrity error.",
            "type": [
              "string",
              "null"
            ],
            "format": "date"
          }
        }
      }
    },
    "interval": {
      "description": "The bar resolution, in the spelling the API and the operator CLI accept.",
      "type": "string",
      "enum": [
        "1m",
        "5m",
        "15m",
        "30m",
        "1h",
        "1d"
      ]
    },
    "from_date": {
      "type": "string",
      "format": "date"
    },
    "to_date": {
      "type": "string",
      "format": "date"
    },
    "transformation_version": {
      "description": "Normalisation rules the bars passed through. A dataset that cannot say which rules produced it cannot be reproduced when those rules change.",
      "type": "integer",
      "minimum": 1
    },
    "validation_version": {
      "type": "integer",
      "minimum": 0
    },
    "adjustment_version": {
      "type": "integer",
      "minimum": 1
    },
    "sources": {
      "description": "Every provider that contributed a row, with what this deployment records about its right to the data. A dataset that cannot say where its rows came from cannot answer whether it may be redistributed.",
      "type": "array",
      "minItems": 1,
      "items": {
        "type": "object",
        "additionalProperties": false,
        "required": [
          "code",
          "licence_note"
        ],
        "properties": {
          "code": {
            "type": "string",
            "minLength": 1
          },
          "licence_note": {
            "type": "string",
            "minLength": 1
          }
        }
      }
    },
    "files": {
      "description": "The data files. Hashes are verified on load, not merely recorded: a reproducible result computed from a silently changed input is worse than no result.",
      "type": "array",
      "minItems": 1,
      "items": {
        "type": "object",
        "additionalProperties": false,
        "required": [
          "name",
          "row_count",
          "bytes",
          "sha256"
        ],
        "properties": {
          "name": {
            "description": "Relative to the dataset build's directory. Never a path.",
            "type": "string",
            "pattern": "^[A-Za-z0-9._-]+$"
          },
          "row_count": {
            "type": "integer",
            "minimum": 0
          },
          "bytes": {
            "type": "integer",
            "minimum": 0
          },
          "sha256": {
            "type": "string",
            "pattern": "^[0-9a-f]{64}$"
          }
        }
      }
    },
    "history_sessions": {
      "description": "How many bars of history the export wrote before each instrument's first membership session in the window (before from_date for an as_of dataset), or 0 for none. A history row is data a feature may read and never membership: membership is still only what spells (or universe_as_of) say. See ADR-025.",
      "type": "integer",
      "minimum": 0,
      "maximum": 1000
    },
    "fundamentals": {
      "description": "What fundamentals.parquet holds, or null when the export carried none (pqt dataset export --fundamentals). One row per instrument and membership session, computed by the same service the surfaces use; history rows get none. Part of content_hash from schema version 4, except licence_note. See ADR-031.",
      "type": [
        "object",
        "null"
      ],
      "additionalProperties": false,
      "required": [
        "ratio_version",
        "source",
        "licence_note",
        "cut",
        "rows",
        "not_collected"
      ],
      "properties": {
        "ratio_version": {
          "description": "The rules the ratios were computed under; ADR-030 is 1. A reader that does not know the version must refuse the build.",
          "type": "integer",
          "minimum": 1
        },
        "source": {
          "description": "The provider codes the statements came from, joined by '+', or 'none' when no exported name has a report.",
          "type": "string",
          "minLength": 1
        },
        "licence_note": {
          "description": "What the deployment records about redistributing that source. Not part of content_hash, as no source's note is.",
          "type": "string"
        },
        "cut": {
          "description": "When a row's statements and actions were read: 00:00 UTC of the session date (07:00 in Hanoi, before the session opens), or known_as_of_utc when that is earlier.",
          "type": "string",
          "const": "session_date_00utc"
        },
        "rows": {
          "description": "Rows in fundamentals.parquet; equal to its files[].row_count.",
          "type": "integer",
          "minimum": 0
        },
        "not_collected": {
          "description": "The exported instruments with no report held at all, ordered by instrument_id. They have no rows: a gap is a different fact from a name whose ratios are all absent.",
          "type": "array",
          "items": {
            "type": "object",
            "additionalProperties": false,
            "required": [
              "instrument_id",
              "reason"
            ],
            "properties": {
              "instrument_id": {
                "type": "string",
                "format": "uuid"
              },
              "reason": {
                "description": "ids_capture_gap: the provider failed on its filings, which may be fixed. out_of_scope: a securities firm or insurer outside the first import. not_imported: nobody has imported its statements yet, or none was recorded by known_as_of_utc.",
                "type": "string",
                "enum": [
                  "ids_capture_gap",
                  "out_of_scope",
                  "not_imported"
                ]
              }
            }
          }
        }
      }
    },
    "row_count": {
      "description": "Total rows across every file. Derived from files[].row_count and written for convenience; it is not part of content_hash because the file hashes it summarises already are.",
      "type": "integer",
      "minimum": 0
    },
    "created_at_utc": {
      "type": "string",
      "format": "date-time"
    },
    "created_by_commit": {
      "description": "The build that produced the export, or null when the build recorded none. Null rather than a placeholder: a dataset claiming a commit it does not know is worse than one that admits it.",
      "type": [
        "string",
        "null"
      ]
    },
    "request": {
      "description": "The labelled-dataset request the export was resolved from (pqt dataset export --request), with each feature's lookback, or null when the export had none. Part of content_hash from schema version 5, rendered with its features sorted by name (ordinal); appended to the dataset id input only when present. See ADR-034.",
      "type": [
        "object",
        "null"
      ],
      "additionalProperties": false,
      "required": [
        "universe",
        "as_of",
        "from",
        "to",
        "interval",
        "fundamentals",
        "rebalance_every",
        "features",
        "label"
      ],
      "properties": {
        "universe": {
          "description": "The universe code.",
          "type": "string",
          "minLength": 1
        },
        "as_of": {
          "description": "Null in version 1: membership is read point-in-time.",
          "type": "null"
        },
        "from": {
          "description": "The first scored session.",
          "type": "string",
          "format": "date"
        },
        "to": {
          "description": "The last session.",
          "type": "string",
          "format": "date"
        },
        "interval": {
          "description": "The bar resolution.",
          "type": "string",
          "minLength": 1
        },
        "fundamentals": {
          "description": "Whether the export carries fundamentals.",
          "type": "boolean"
        },
        "rebalance_every": {
          "description": "Sessions between rebalances.",
          "type": "integer",
          "minimum": 1
        },
        "features": {
          "description": "The features, in the order the request file held them.",
          "type": "array",
          "minItems": 1,
          "items": {
            "type": "object",
            "additionalProperties": false,
            "required": [
              "name",
              "version",
              "lookback"
            ],
            "properties": {
              "name": {
                "description": "The feature's name in the registry.",
                "type": "string",
                "minLength": 1
              },
              "version": {
                "description": "Its version.",
                "type": "integer",
                "minimum": 1
              },
              "lookback": {
                "description": "Sessions it reads, counting the as-of.",
                "type": "integer",
                "minimum": 1
              }
            }
          }
        },
        "label": {
          "description": "The forward return from the rebalance close to the close horizon sessions later.",
          "type": "object",
          "additionalProperties": false,
          "required": [
            "horizon",
            "basis"
          ],
          "properties": {
            "horizon": {
              "description": "Equal to rebalance_every in version 1.",
              "type": "integer",
              "minimum": 1
            },
            "basis": {
              "description": "The close it is valued on: adjusted only in version 1.",
              "type": "string",
              "const": "adjusted"
            }
          }
        }
      }
    }
  }
}
